{
  "schema_version": "s08-final-architecture-findings/v1",
  "generated_at": "2026-05-09T18:59:43Z",
  "source_artifacts": {
    "s07_review_findings": "prd/04_review_findings.md",
    "s04_falkordb_smoke": "prd/milestone_proofs/M001_S04_FALKORDB-CAPABILITY-SMOKE.json",
    "s05_odt_parser_findings": "prd/milestone_proofs/M001_S05_ODT-PARSER-FINDINGS.md",
    "s09_local_embedding_evaluation": "prd/milestone_proofs/M001_S09_LOCAL-EMBEDDING-EVALUATION.json",
    "s10_embedding_runtime_proof": "prd/milestone_proofs/M001_S10_EMBEDDING-RUNTIME-PROOF.json"
  },
  "findings": [
    {
      "id": "S07-FIXED-PRD-CONSISTENCY",
      "title": "S07 PRD consistency blockers and major specification mismatches are fixed",
      "source": [
        "prd/04_review_findings.md#S07-final-status-and-S08-handoff"
      ],
      "claim_class": "prd-fixed",
      "status": "fixed",
      "severity": "INFO",
      "evidence": [
        {
          "artifact": "prd/04_review_findings.md",
          "status": "fixed",
          "summary": "All original BLOCKER findings F-001, F-005, F-006, and F-014 are marked FIXED; fixed major architecture consistency findings are summarized in the S07 final status notes."
        }
      ],
      "impact": "M001 can move from PRD normalization to final architecture reporting without reopening S07-fixed wording issues.",
      "recommendation": "Treat S07-fixed items as closed unless new source or runtime evidence contradicts the normalized PRD text.",
      "owner": "S08 final architecture review",
      "resolution_path": "Carry only the remaining deferred/bounded issues into the final report; cite fixed S07 themes as upstream closure evidence.",
      "verification_criteria": "Final report distinguishes fixed PRD consistency work from deferred proof gates and does not reclassify fixed blockers as open.",
      "roadmap_effect": "Allows M002 planning to start from normalized PRD documents while preserving explicit proof gates for unresolved architecture risks.",
      "requirement_links": [
        "R001",
        "R009",
        "R010"
      ],
      "non_goals": [
        "No product ETL, production graph schema, KnowQL parser, LegalNexus API, or hybrid retrieval implementation."
      ]
    },
    {
      "id": "G-005",
      "title": "Same-date multi-edition conflict policy remains deferred",
      "source": [
        "prd/04_review_findings.md#S08-handoff-unresolved-deferred-findings"
      ],
      "claim_class": "deferred-proof-gate",
      "status": "deferred",
      "severity": "MAJOR",
      "evidence": [
        {
          "artifact": "prd/04_review_findings.md",
          "status": "DEFERRED",
          "summary": "FR-1a and architecture text define changed-SHA/new-edition behavior, but same-date multi-edition conflict policy remains owned by S08 temporal model."
        }
      ],
      "impact": "Without a policy, conflicting consolidated editions for one date may create ambiguous temporal answers and import validation behavior.",
      "recommendation": "Define whether same-date collisions become source revisions, competing ActEdition candidates, or validation-blocking conflicts before implementation.",
      "owner": "S08 temporal model / future temporal proof slice",
      "resolution_path": "Design conflict semantics with VERSION_OF, SUPERSEDES, and AMENDED_BY event behavior and add validation-report expectations for ambiguous same-date collisions.",
      "verification_criteria": "Executable validation fixtures cover same-date multi-edition collisions and prove deterministic active_at/no-answer behavior.",
      "roadmap_effect": "Blocks reliable temporal roadmap details for multi-source or conflicting consolidated editions; does not block single-source MVP import if ambiguity is rejected.",
      "requirement_links": [
        "R001",
        "R009",
        "R010"
      ]
    },
    {
      "id": "G-008",
      "title": "Executable parser and retrieval golden tests are deferred proof gates",
      "source": [
        "prd/04_review_findings.md#S08-handoff-unresolved-deferred-findings",
        "prd/milestone_proofs/M001_S05_ODT-PARSER-FINDINGS.md"
      ],
      "claim_class": "deferred-proof-gate",
      "status": "deferred",
      "severity": "MAJOR",
      "evidence": [
        {
          "artifact": "prd/04_review_findings.md",
          "status": "DEFERRED",
          "summary": "FR-30 and 16_retrieval_eval.json skeleton exist, but tracked golden parser/retrieval fixtures and executable recall tests are not authored."
        },
        {
          "artifact": "prd/milestone_proofs/M001_S05_ODT-PARSER-FINDINGS.md",
          "status": "parser-smoke-bounded",
          "summary": "S05 verifies real ODT smoke evidence and parser direction only; it does not prove final legal hierarchy, SourceBlock, EvidenceSpan, or retrieval quality."
        }
      ],
      "impact": "Parser or retrieval quality claims would be unsupported until real tracked fixtures exercise citation round-trips, no-answer behavior, and baseline recall.",
      "recommendation": "Schedule golden parser/retrieval test authoring before any milestone depends on parser quality or retrieval recall metrics.",
      "owner": "S08 validation/proof planning / future parser-retrieval proof slice",
      "resolution_path": "Convert smoke evidence and FR-30 skeletons into tracked fixtures, expected outputs, no-answer cases, and recall metrics tied to parser-produced evidence IDs.",
      "verification_criteria": "CI runs golden parser tests, citation round-trip checks, no-answer tests, and retrieval recall checks against tracked fixtures without reading ignored local-only artifacts.",
      "roadmap_effect": "Required before claiming parser/retrieval quality in M002-M007; does not invalidate M001 architecture-only closure.",
      "requirement_links": [
        "R001",
        "R009",
        "R010"
      ],
      "non_goals": [
        "Do not treat S05 marker/table counts as final legal extraction facts."
      ]
    },
    {
      "id": "G-011",
      "title": "Embedding offline/local language policy remains bounded by S09/S10 evidence",
      "source": [
        "prd/04_review_findings.md#S08-handoff-unresolved-deferred-findings",
        "prd/milestone_proofs/M001_S09_LOCAL-EMBEDDING-EVALUATION.json",
        "prd/milestone_proofs/M001_S10_EMBEDDING-RUNTIME-PROOF.json"
      ],
      "claim_class": "embedding-boundary",
      "status": "confirmed-runtime",
      "severity": "MINOR",
      "evidence": [
        {
          "artifact": "prd/milestone_proofs/M001_S09_LOCAL-EMBEDDING-EVALUATION.json",
          "status": "bounded-recommendation-blocked-environment",
          "summary": "S09 recommends USER-bge-m3 as practical baseline only by integration posture and excludes managed embedding APIs."
        },
        {
          "artifact": "prd/milestone_proofs/M001_S10_EMBEDDING-RUNTIME-PROOF.json",
          "status": "confirmed-runtime",
          "summary": "S10 confirms local/open-weight deepvk/USER-bge-m3 encode and live 1024-dimensional FalkorDB vector proof on this host; GigaEmbeddings remains blocked by safety/runtime gates."
        }
      ],
      "impact": "Embedding architecture can cite a bounded local baseline but cannot claim production legal retrieval quality or managed API suitability.",
      "recommendation": "Use USER-bge-m3 as the default local/open-weight runtime baseline for downstream planning; keep GigaEmbeddings as a deferred challenger and exclude managed GigaChat API paths.",
      "owner": "Future embedding/runtime proof",
      "resolution_path": "Repeat USER-bge-m3 proof on target hardware and evaluate parser-produced EvidenceSpan/SourceBlock fixtures before legal-quality or production SLO claims.",
      "verification_criteria": "Future embedding proof records package/cache/download/runtime status, vector dimension, FalkorDB query proof, no raw vector leakage, and real evidence-backed retrieval metrics.",
      "roadmap_effect": "No MVP impact while embeddings remain post-MVP; affects Phase 5/vector-search readiness and M002 proof budgeting.",
      "requirement_links": [
        "R001",
        "R009",
        "R010"
      ],
      "decision_links": [
        "D002",
        "D003"
      ],
      "non_goals": [
        "No managed GigaChat/GigaChat API fallback.",
        "No production Russian legal retrieval quality claim from fixture-only metrics."
      ]
    },
    {
      "id": "G-015",
      "title": "FalkorDBLite to Docker migration failure-mode runbook is deferred",
      "source": [
        "prd/04_review_findings.md#S08-handoff-unresolved-deferred-findings",
        "prd/milestone_proofs/M001_S04_FALKORDB-CAPABILITY-SMOKE.json"
      ],
      "claim_class": "deferred-proof-gate",
      "status": "deferred",
      "severity": "MINOR",
      "evidence": [
        {
          "artifact": "prd/04_review_findings.md",
          "status": "DEFERRED",
          "summary": "Architecture text defines an evolution path but not a tested migration runbook."
        },
        {
          "artifact": "prd/milestone_proofs/M001_S04_FALKORDB-CAPABILITY-SMOKE.json",
          "status": "confirmed-runtime",
          "summary": "S04 confirms bounded Docker FalkorDB and FalkorDBLite mechanics separately, not embedded-to-container migration safety."
        }
      ],
      "impact": "Deployment milestones could overclaim safe embedded-to-container transition without export/import, persistence, rollback, auth/port, and smoke validation proof.",
      "recommendation": "Add a migration runbook and smoke validation proof before any deployment milestone claims safe FalkorDBLite to Docker migration.",
      "owner": "S08 deployment planning or later ops proof",
      "resolution_path": "Define export/import, persistence checks, rollback path, port/auth configuration, and post-migration smoke commands as a deployment proof gate.",